{
  "accounting": {
    "citation_count": 2,
    "hunk_coverage_ratio": 1.0,
    "hunk_covered": 1,
    "hunk_total": 1,
    "line_coverage_ratio": 1.0,
    "line_owned": 2,
    "line_total": 2,
    "span_coverage_ratio": 1.0,
    "span_owned": 2,
    "span_total": 2,
    "unit_coverage_ratio": 1.0,
    "unit_covered": 1,
    "unit_total": 1
  },
  "audit_status": {
    "actor_type": "agent",
    "adjudicator": "GitHub Copilot CLI (Claude Sonnet 5, orchestrating session)",
    "disagreement_count": 0,
    "disagreement_rate": 0.0,
    "mode": "dual_audit"
  },
  "candidate_id": "captured_config_b",
  "candidate_kind": "captured_real_run",
  "case_id": "reordering-guard-clause",
  "claim_factuality": {
    "assessable_count": 4,
    "assessable_weight": 18,
    "ratio": 1.0,
    "supported_count": 4,
    "supported_weight": 18
  },
  "contradicted_claims": {
    "claim_ids": [],
    "count": 0,
    "weight": 0
  },
  "explanation_sha256": "832e6ad6a6e8c495abb2f9a6b0ad6750e77dad3f7a7d2293b095f515a264fcca",
  "gate": null,
  "required_behavior_coverage": {
    "ratio": 0.3333333333333333,
    "satisfied_count": 1,
    "satisfied_ids": [
      "guard-moved-after-lookup"
    ],
    "total_count": 3
  },
  "rubric_match_heuristic": null,
  "schema": "shiftory.benchmark-agent-quality-score/v1",
  "semantic_omissions": {
    "missed_count": 2,
    "missed_ids": [
      "lookup-none-implication-uncertain",
      "return-contract-unchanged-for-resolved-lookups"
    ],
    "missed_weight": 6
  },
  "structural_failure": null,
  "uncertainty_honesty": {
    "checked": 4,
    "violation_ids": [],
    "violations": 0
  },
  "unsupported_claims": {
    "claim_ids": [],
    "count": 0,
    "weight": 0
  },
  "usefulness_relevance": {
    "ambiguous_unresolvable_claims": 0,
    "item_count": 1,
    "non_semantic_claims": 0,
    "useful_count": 4
  }
}
