{
  "accounting": {
    "citation_count": 3,
    "hunk_coverage_ratio": 1.0,
    "hunk_covered": 0,
    "hunk_total": 0,
    "line_coverage_ratio": 1.0,
    "line_owned": 0,
    "line_total": 0,
    "span_coverage_ratio": 1.0,
    "span_owned": 0,
    "span_total": 0,
    "unit_coverage_ratio": 1.0,
    "unit_covered": 1,
    "unit_total": 1
  },
  "audit_status": {
    "actor_type": "agent",
    "adjudicator": "GitHub Copilot CLI (Claude Sonnet 5, orchestrating session)",
    "disagreement_count": 1,
    "disagreement_rate": 0.3333333333333333,
    "mode": "dual_audit"
  },
  "candidate_id": "captured_config_a",
  "candidate_kind": "captured_real_run",
  "case_id": "binary-asset-replacement",
  "claim_factuality": {
    "assessable_count": 3,
    "assessable_weight": 15,
    "ratio": 1.0,
    "supported_count": 3,
    "supported_weight": 15
  },
  "contradicted_claims": {
    "claim_ids": [],
    "count": 0,
    "weight": 0
  },
  "explanation_sha256": "0b36dfefc2a5a920c5b420aa5cc0546e7fbecd04821f8940591da0ac7f66a7e5",
  "gate": null,
  "required_behavior_coverage": {
    "ratio": 0.6666666666666666,
    "satisfied_count": 2,
    "satisfied_ids": [
      "binary-content-replaced",
      "content-meaning-not-available"
    ],
    "total_count": 3
  },
  "rubric_match_heuristic": null,
  "schema": "shiftory.benchmark-agent-quality-score/v1",
  "semantic_omissions": {
    "missed_count": 1,
    "missed_ids": [
      "mode-unchanged"
    ],
    "missed_weight": 2
  },
  "structural_failure": null,
  "uncertainty_honesty": {
    "checked": 3,
    "violation_ids": [],
    "violations": 0
  },
  "unsupported_claims": {
    "claim_ids": [],
    "count": 0,
    "weight": 0
  },
  "usefulness_relevance": {
    "ambiguous_unresolvable_claims": 0,
    "item_count": 3,
    "non_semantic_claims": 0,
    "useful_count": 3
  }
}
